{
  "$schema": "./sh-ui.schema.json",
  "platform": "react",
  "style": "default",
  "theme": {
    "base": "neutral",
    "radius": "md",
    "mode": "light-dark"
  },
  "paths": {
    "tokens": "src/styles/tokens.css",
    "components": "src/components/ui",
    "utils": "src/lib/utils.ts"
  },
  "aliases": {
    "components": "@/components",
    "utils": "@/lib/utils",
    "ui": "@/components/ui"
  }
}
